{
  "schema_version": 1,
  "nodes": [
    {"id": "input", "type": "wav_input", "parameters": {"path": "input.wav"}},
    {"id": "output", "type": "wav_output", "parameters": {"path": "passthrough.wav"}}
  ],
  "connections": [{"from": {"node": "input", "port": "audio"}, "to": {"node": "output", "port": "audio"}}],
  "exports": [{"name": "file", "node": "output", "port": "path"}]
}
