{
  "schema_version": 1,
  "nodes": [
    {"id":"input","type":"realtime_input","parameters":{"device_id":"SELECT_INPUT_DEVICE"}},
    {"id":"gain","type":"org.audiograph.realtime_example.gain_v1","parameters":{"gain_db":-6}},
    {"id":"output","type":"realtime_output","parameters":{"device_id":"SELECT_OUTPUT_DEVICE"}}
  ],
  "connections": [
    {"from":{"node":"input","port":"audio"},"to":{"node":"gain","port":"audio"}},
    {"from":{"node":"gain","port":"audio"},"to":{"node":"output","port":"audio"}}
  ],
  "exports": []
}
